{
  "ticket_id": "T-20260514-232121",
  "worker": "worker-2",
  "engine": "claude",
  "model": "claude-sonnet-4-6",
  "rubric": {
    "correctness": 9,
    "scope_discipline": 10,
    "test_coverage": 8,
    "code_quality": 8,
    "alignment_with_acceptance": 9
  },
  "total": 44,
  "verdict": "merge",
  "acceptance_results": [
    {"cmd": "bash tests/score-schema/test.sh", "exit": 0}
  ],
  "quality_eval_summary": "type_safety=9 modularity=8 test_coverage=8 error_handling=9 documentation=7",
  "incentive": 5,
  "penalty": 0,
  "notes": "score.schema.json correctly validates all required fields. test.sh mirrors ticket-schema pattern with jsonschema/jq fallback. valid.json rubric sums to total=44."
}
